{
    "edges": [
        {
            "from": "source",
            "name": "source_ref-chrA:1350-1502",
            "to": "ref-chrA:1350-1502"
        },
        {
            "from": "ref-chrA:1350-1502",
            "name": "ref-chrA:1350-1502_chrA:1503-1506:AGTAA",
            "sequences": [
                "swap1:1"
            ],
            "to": "chrA:1503-1506:AGTAA"
        },
        {
            "from": "ref-chrA:1350-1502",
            "name": "ref-chrA:1350-1502_ref-chrA:1503-1506",
            "sequences": [
                "REF",
                "swap1:0"
            ],
            "to": "ref-chrA:1503-1506"
        },
        {
            "from": "chrA:1503-1506:AGTAA",
            "name": "chrA:1503-1506:AGTAA_ref-chrA:1507-1509",
            "sequences": [
                "swap1:1"
            ],
            "to": "ref-chrA:1507-1509"
        },
        {
            "from": "ref-chrA:1503-1506",
            "name": "ref-chrA:1503-1506_ref-chrA:1507-1509",
            "sequences": [
                "REF",
                "swap1:0"
            ],
            "to": "ref-chrA:1507-1509"
        },
        {
            "from": "ref-chrA:1507-1509",
            "name": "ref-chrA:1507-1509_ref-chrA:1510-1659",
            "sequences": [
                "REF",
                "swap1:0",
                "swap1:1"
            ],
            "to": "ref-chrA:1510-1659"
        },
        {
            "from": "ref-chrA:1510-1659",
            "name": "ref-chrA:1510-1659_sink",
            "to": "sink"
        }
    ],
    "model_name": "Graph from /Users/schen6/Documents/paragraph-tools/share/test-data/genotyping_test_2/chrA.vcf",
    "nodes": [
        {
            "name": "source",
            "sequence": "NNNNNNNNNN"
        },
        {
            "name": "ref-chrA:1350-1502",
            "reference": "chrA:1350-1502",
            "reference_sequence": "GAGCGTCAAAGGCCCGTCCTATAGACCTGAAGAGTGTTGAGAGTTCTATGGAAAAATTTATAGAGTACTTCCCAGTGTTTTAACTGTAACTGACTTCCATGATCATTTCAGTAATGCAGCCCACATGCATGTTCAAGACTAACACACCGTGCT"
        },
        {
            "name": "chrA:1503-1506:AGTAA",
            "position": "chrA:1503-1506",
            "sequence": "AGTAA"
        },
        {
            "name": "ref-chrA:1503-1506",
            "reference": "chrA:1503-1506",
            "reference_sequence": "GCCC"
        },
        {
            "name": "ref-chrA:1507-1509",
            "reference": "chrA:1507-1509",
            "reference_sequence": "CTT"
        },
        {
            "name": "ref-chrA:1510-1659",
            "reference": "chrA:1510-1659",
            "reference_sequence": "CGTTGACCCTGGTAGAAGTTAGCGGGGCTTGTTTAAGGTCGCGTCGGAATATATGATTTACATAACTGTCACTTTGGGACGCACCCGGCCTTATGGCCATGTGTATTGATAGACTGTCAACCTAACAAGAAAAATTAACGCTTTCCCGAC"
        },
        {
            "name": "sink",
            "sequence": "NNNNNNNNNN"
        }
    ],
    "paths": [
        {
            "nodes": [
                "ref-chrA:1350-1502",
                "ref-chrA:1503-1506",
                "ref-chrA:1507-1509",
                "ref-chrA:1510-1659"
            ],
            "path_id": "REF|1",
            "sequence": "REF"
        }
    ],
    "sequencenames": [
        "REF",
        "swap1:0",
        "swap1:1"
    ],
    "target_regions": [
        "chrA:1350-1659"
    ]
}
