{
    "edges": [
        {
            "from": "source",
            "name": "source_ref-chr1:239404557-239404706",
            "to": "ref-chr1:239404557-239404706"
        },
        {
            "from": "ref-chr1:239404557-239404706",
            "name": "ref-chr1:239404557-239404706_ref-chr1:239404707-239404707",
            "sequences": [
                "REF",
                "chr1:239404707-1:0"
            ],
            "to": "ref-chr1:239404707-239404707"
        },
        {
            "from": "ref-chr1:239404557-239404706",
            "name": "ref-chr1:239404557-239404706_chr1:239404707-239404707:G",
            "sequences": [
                "chr1:239404707-1:1"
            ],
            "to": "chr1:239404707-239404707:G"
        },
        {
            "from": "ref-chr1:239404707-239404707",
            "name": "ref-chr1:239404707-239404707_ref-chr1:239404708-239404719",
            "sequences": [
                "REF",
                "chr1:239404707-1:0"
            ],
            "to": "ref-chr1:239404708-239404719"
        },
        {
            "from": "chr1:239404707-239404707:G",
            "name": "chr1:239404707-239404707:G_ref-chr1:239404708-239404719",
            "sequences": [
                "chr1:239404707-1:1"
            ],
            "to": "ref-chr1:239404708-239404719"
        },
        {
            "from": "ref-chr1:239404708-239404719",
            "name": "ref-chr1:239404708-239404719_chr1:239404720-239404719:ATAT",
            "sequences": [
                "chr1:239404719-1:1"
            ],
            "to": "chr1:239404720-239404719:ATAT"
        },
        {
            "from": "ref-chr1:239404708-239404719",
            "name": "ref-chr1:239404708-239404719_ref-chr1:239404720-239404728",
            "sequences": [
                "REF",
                "chr1:239404719-1:0"
            ],
            "to": "ref-chr1:239404720-239404728"
        },
        {
            "from": "chr1:239404720-239404719:ATAT",
            "name": "chr1:239404720-239404719:ATAT_ref-chr1:239404720-239404728",
            "sequences": [
                "chr1:239404719-1:1"
            ],
            "to": "ref-chr1:239404720-239404728"
        },
        {
            "from": "ref-chr1:239404720-239404728",
            "name": "ref-chr1:239404720-239404728_ref-chr1:239404729-239404731",
            "sequences": [
                "REF",
                "chr1:239404728-1:0"
            ],
            "to": "ref-chr1:239404729-239404731"
        },
        {
            "from": "ref-chr1:239404720-239404728",
            "name": "ref-chr1:239404720-239404728_ref-chr1:239404732-239404881",
            "sequences": [
                "chr1:239404728-1:1"
            ],
            "to": "ref-chr1:239404732-239404881"
        },
        {
            "from": "ref-chr1:239404729-239404731",
            "name": "ref-chr1:239404729-239404731_ref-chr1:239404732-239404881",
            "sequences": [
                "REF",
                "chr1:239404728-1:0"
            ],
            "to": "ref-chr1:239404732-239404881"
        },
        {
            "from": "ref-chr1:239404732-239404881",
            "name": "ref-chr1:239404732-239404881_sink",
            "to": "sink"
        }
    ],
    "model_name": "Graph from pg-complex/pg-complex-2.vcf",
    "nodes": [
        {
            "name": "source",
            "sequence": "NNNNNNNNNN"
        },
        {
            "name": "ref-chr1:239404557-239404706",
            "reference": "chr1:239404557-239404706",
            "reference_sequence": "TCTGGTAAGATGAGTCGTATTCAACTTGAGATGTTTCTCAGGCTTTGCAAAGGGTGGAGTGCTCTTTCCCACTGAAATATAAACACAATAGAGCAAGAACTCAGATGTCCGCTGGAAAATTAAGTTGAAACCGCTTCCATTAAATGTATC"
        },
        {
            "name": "ref-chr1:239404707-239404707",
            "reference": "chr1:239404707-239404707",
            "reference_sequence": "A"
        },
        {
            "name": "chr1:239404707-239404707:G",
            "position": "chr1:239404707-239404707",
            "sequence": "G"
        },
        {
            "name": "ref-chr1:239404708-239404719",
            "reference": "chr1:239404708-239404719",
            "reference_sequence": "TGCTATATCTAA"
        },
        {
            "name": "chr1:239404720-239404719:ATAT",
            "position": "chr1:239404720-239404719",
            "sequence": "ATAT"
        },
        {
            "name": "ref-chr1:239404720-239404728",
            "reference": "chr1:239404720-239404728",
            "reference_sequence": "ATATATATA"
        },
        {
            "name": "ref-chr1:239404729-239404731",
            "reference": "chr1:239404729-239404731",
            "reference_sequence": "TAT"
        },
        {
            "name": "ref-chr1:239404732-239404881",
            "reference": "chr1:239404732-239404881",
            "reference_sequence": "ATATATATATATATATATATATATATGGAAAATATGGTTAACAATGTTCACAGGGTACTATAAAAACAGAAAGTGTTATCTCAAATATACGCAGTTCTTAACTTTTTTTGTTTTTCTCTTGAGTTCTATCAGGGAGCTGACTATCAAAAA"
        },
        {
            "name": "sink",
            "sequence": "NNNNNNNNNN"
        }
    ],
    "paths": [
        {
            "nodes": [
                "ref-chr1:239404557-239404706",
                "ref-chr1:239404707-239404707",
                "ref-chr1:239404708-239404719",
                "ref-chr1:239404720-239404728",
                "ref-chr1:239404729-239404731",
                "ref-chr1:239404732-239404881"
            ],
            "path_id": "REF|1",
            "sequence": "REF"
        }
    ],
    "sequencenames": [
        "REF",
        "chr1:239404707-1:0",
        "chr1:239404707-1:1",
        "chr1:239404719-1:0",
        "chr1:239404719-1:1",
        "chr1:239404728-1:0",
        "chr1:239404728-1:1"
    ],
    "target_regions": [
        "chr1:239404557-239404881"
    ]
}
