{
    "edges": [
        {
            "from": "source",
            "name": "source_ref-chr20:149008-149013",
            "to": "ref-chr20:149008-149013"
        },
        {
            "from": "ref-chr20:149008-149013",
            "name": "ref-chr20:149008-149013_chr20:149014-149013:CCATATTTGGGAGGCAATTTTACCTGTTCTCAAGGCCGCATCTCTACCCCATCTCATGCGAATCCTGAC",
            "sequences": [
                "HG002_pbsv.INS.49079:1"
            ],
            "to": "chr20:149014-149013:CCATATTTGGGAGGCAATTTTACCTGTTCTCAAGGCCGCATCTCTACCCCATCTCATGCGAATCCTGAC"
        },
        {
            "from": "ref-chr20:149008-149013",
            "name": "ref-chr20:149008-149013_ref-chr20:149014-149018",
            "sequences": [
                "HG002_pbsv.INS.49079:0",
                "REF"
            ],
            "to": "ref-chr20:149014-149018"
        },
        {
            "from": "chr20:149014-149013:CCATATTTGGGAGGCAATTTTACCTGTTCTCAAGGCCGCATCTCTACCCCATCTCATGCGAATCCTGAC",
            "name": "chr20:149014-149013:CCATATTTGGGAGGCAATTTTACCTGTTCTCAAGGCCGCATCTCTACCCCATCTCATGCGAATCCTGAC_ref-chr20:149014-149018",
            "sequences": [
                "HG002_pbsv.INS.49079:1"
            ],
            "to": "ref-chr20:149014-149018"
        },
        {
            "from": "ref-chr20:149014-149018",
            "name": "ref-chr20:149014-149018_sink",
            "to": "sink"
        }
    ],
    "model_name": "Graph from ../paragraph-tools/share/test-data/paragraph/insertions/insertion-test-1.vcf",
    "nodes": [
        {
            "name": "source",
            "sequence": "NNNNNNNNNN"
        },
        {
            "name": "ref-chr20:149008-149013",
            "reference": "chr20:149008-149013",
            "reference_sequence": "GAACAA"
        },
        {
            "name": "chr20:149014-149013:CCATATTTGGGAGGCAATTTTACCTGTTCTCAAGGCCGCATCTCTACCCCATCTCATGCGAATCCTGAC",
            "position": "chr20:149014-149013",
            "sequence": "CCATATTTGGGAGGCAATTTTACCTGTTCTCAAGGCCGCATCTCTACCCCATCTCATGCGAATCCTGAC"
        },
        {
            "name": "ref-chr20:149014-149018",
            "reference": "chr20:149014-149018",
            "reference_sequence": "CCATA"
        },
        {
            "name": "sink",
            "sequence": "NNNNNNNNNN"
        }
    ],
    "paths": [
        {
            "nodes": [
                "ref-chr20:149008-149013",
                "ref-chr20:149014-149018"
            ],
            "path_id": "REF|1",
            "sequence": "REF"
        },
        {
            "nodes": [
                "ref-chr20:149008-149013",
                "chr20:149014-149013:CCATATTTGGGAGGCAATTTTACCTGTTCTCAAGGCCGCATCTCTACCCCATCTCATGCGAATCCTGAC",
                "ref-chr20:149014-149018"
            ],
            "path_id": "ALT|1",
            "sequence": "ALT"
        }
    ],
    "sequencenames": [
        "ALT",
        "HG002_pbsv.INS.49079:0",
        "HG002_pbsv.INS.49079:1",
        "REF"
    ],
    "target_regions": [
        "chr20:149008-149018"
    ]
}
