{
    "edges": [
        {
            "from": "source",
            "name": "source_ref-chrB:1350-1500",
            "to": "ref-chrB:1350-1500"
        },
        {
            "from": "ref-chrB:1350-1500",
            "name": "ref-chrB:1350-1500_chrB:1501-1509:TCAGGTTGTCTTATGCTTGGCATCGTTCTT",
            "sequences": [
                "swap2:1"
            ],
            "to": "chrB:1501-1509:TCAGGTTGTCTTATGCTTGGCATCGTTCTT"
        },
        {
            "from": "ref-chrB:1350-1500",
            "name": "ref-chrB:1350-1500_ref-chrB:1501-1509",
            "sequences": [
                "REF",
                "swap2:0"
            ],
            "to": "ref-chrB:1501-1509"
        },
        {
            "from": "chrB:1501-1509:TCAGGTTGTCTTATGCTTGGCATCGTTCTT",
            "name": "chrB:1501-1509:TCAGGTTGTCTTATGCTTGGCATCGTTCTT_ref-chrB:1510-1659",
            "sequences": [
                "swap2:1"
            ],
            "to": "ref-chrB:1510-1659"
        },
        {
            "from": "ref-chrB:1501-1509",
            "name": "ref-chrB:1501-1509_ref-chrB:1510-1659",
            "sequences": [
                "REF",
                "swap2:0"
            ],
            "to": "ref-chrB:1510-1659"
        },
        {
            "from": "ref-chrB:1510-1659",
            "name": "ref-chrB:1510-1659_sink",
            "to": "sink"
        }
    ],
    "model_name": "Graph from /Users/schen6/Documents/paragraph-tools/share/test-data/genotyping_test_2/chrB.vcf",
    "nodes": [
        {
            "name": "source",
            "sequence": "NNNNNNNNNN"
        },
        {
            "name": "ref-chrB:1350-1500",
            "reference": "chrB:1350-1500",
            "reference_sequence": "TCTAACAATTACGGAGGAGAACCGGTCTCCCCCCACGGTGGAGCGTATACGTCGTTAATGGTGGGGAAGTCAATACGACCGACTGTCCATGGTCATGCCCCTATCGTCGGATTCACGCTGCTTTACCTCAAAGTCAACCCAGCCGTAGTTA"
        },
        {
            "name": "chrB:1501-1509:TCAGGTTGTCTTATGCTTGGCATCGTTCTT",
            "position": "chrB:1501-1509",
            "sequence": "TCAGGTTGTCTTATGCTTGGCATCGTTCTT"
        },
        {
            "name": "ref-chrB:1501-1509",
            "reference": "chrB:1501-1509",
            "reference_sequence": "GGCCATACG"
        },
        {
            "name": "ref-chrB:1510-1659",
            "reference": "chrB:1510-1659",
            "reference_sequence": "CACAGGCTATCTGTAAATCATCAAATCATGGTACCTATCTCGGGTACCACATTAATCTTACGCGCCAGAGCCTTGGAATGGGCTCTTCAGTTACCTGTAAGCGGCTTCTATCTTCAGCGCAGAGCGTGCACCGGGTTATAGGCCTAGAGG"
        },
        {
            "name": "sink",
            "sequence": "NNNNNNNNNN"
        }
    ],
    "paths": [
        {
            "nodes": [
                "ref-chrB:1350-1500",
                "ref-chrB:1501-1509",
                "ref-chrB:1510-1659"
            ],
            "path_id": "REF|1",
            "sequence": "REF"
        }
    ],
    "sequencenames": [
        "REF",
        "swap2:0",
        "swap2:1"
    ],
    "target_regions": [
        "chrB:1350-1659"
    ]
}
