{
    "edges": [
        {
            "from": "source",
            "name": "source_ref-chr5:70243962-70244112",
            "to": "ref-chr5:70243962-70244112"
        },
        {
            "from": "source",
            "name": "source_ref-chr5:70248850-70248999",
            "to": "ref-chr5:70248850-70248999"
        },
        {
            "from": "ref-chr5:70243962-70244112",
            "name": "ref-chr5:70243962-70244112_ref-chr5:70244113-70244412",
            "sequences": [
                "REF"
            ],
            "to": "ref-chr5:70244113-70244412"
        },
        {
            "from": "ref-chr5:70243962-70244112",
            "name": "ref-chr5:70243962-70244112_chr5:70244113-70248999:ACACAC",
            "sequences": [
                "ALT"
            ],
            "to": "chr5:70244113-70248999:ACACAC"
        },
        {
            "from": "ref-chr5:70244113-70244412",
            "name": "ref-chr5:70244113-70244412_sink",
            "to": "sink"
        },
        {
            "from": "chr5:70244113-70248999:ACACAC",
            "name": "chr5:70244113-70248999:ACACAC_ref-chr5:70249000-70249149",
            "sequences": [
                "ALT"
            ],
            "to": "ref-chr5:70249000-70249149"
        },
        {
            "from": "ref-chr5:70248850-70248999",
            "name": "ref-chr5:70248850-70248999_ref-chr5:70249000-70249149",
            "sequences": [
                "REF"
            ],
            "to": "ref-chr5:70249000-70249149"
        },
        {
            "from": "ref-chr5:70249000-70249149",
            "name": "ref-chr5:70249000-70249149_sink",
            "to": "sink"
        }
    ],
    "model_name": "Graph from simple/swap-example-5.vcf",
    "nodes": [
        {
            "name": "source",
            "sequence": "NNNNNNNNNN"
        },
        {
            "name": "ref-chr5:70243962-70244112",
            "reference": "chr5:70243962-70244112"
        },
        {
            "name": "ref-chr5:70244113-70244412",
            "reference": "chr5:70244113-70244412"
        },
        {
            "name": "chr5:70244113-70248999:ACACAC",
            "position": "chr5:70244113-70248999",
            "sequence": "ACACAC"
        },
        {
            "name": "ref-chr5:70248850-70248999",
            "reference": "chr5:70248850-70248999"
        },
        {
            "name": "ref-chr5:70249000-70249149",
            "reference": "chr5:70249000-70249149"
        },
        {
            "name": "sink",
            "sequence": "NNNNNNNNNN"
        }
    ],
    "paths": [
        {
            "nodes": [
                "ref-chr5:70243962-70244112",
                "ref-chr5:70244113-70244412"
            ],
            "path_id": "REF|1",
            "sequence": "REF"
        },
        {
            "nodes": [
                "ref-chr5:70248850-70248999",
                "ref-chr5:70249000-70249149"
            ],
            "path_id": "REF|2",
            "sequence": "REF"
        }
    ],
    "sequencenames": [
        "ALT",
        "REF"
    ],
    "target_regions": [
        "chr5:70243962-70244412",
        "chr5:70248850-70249149"
    ]
}
