{
    "edges": [
        {
            "from": "source",
            "name": "source_ref-chr5:70243962-70244111",
            "to": "ref-chr5:70243962-70244111"
        },
        {
            "from": "ref-chr5:70243962-70244111",
            "name": "ref-chr5:70243962-70244111_ref-chr5:70244112-70245000",
            "sequences": [
                "REF"
            ],
            "to": "ref-chr5:70244112-70245000"
        },
        {
            "from": "ref-chr5:70243962-70244111",
            "name": "ref-chr5:70243962-70244111_ref-chr5:70245001-70245150",
            "sequences": [
                "ALT"
            ],
            "to": "ref-chr5:70245001-70245150"
        },
        {
            "from": "ref-chr5:70244112-70245000",
            "name": "ref-chr5:70244112-70245000_ref-chr5:70245001-70245150",
            "sequences": [
                "REF"
            ],
            "to": "ref-chr5:70245001-70245150"
        },
        {
            "from": "ref-chr5:70245001-70245150",
            "name": "ref-chr5:70245001-70245150_sink",
            "to": "sink"
        }
    ],
    "model_name": "Graph from simple/del-example-3.vcf",
    "nodes": [
        {
            "name": "source",
            "sequence": "NNNNNNNNNN"
        },
        {
            "name": "ref-chr5:70243962-70244111",
            "reference": "chr5:70243962-70244111"
        },
        {
            "name": "ref-chr5:70244112-70245000",
            "reference": "chr5:70244112-70245000"
        },
        {
            "name": "ref-chr5:70245001-70245150",
            "reference": "chr5:70245001-70245150"
        },
        {
            "name": "sink",
            "sequence": "NNNNNNNNNN"
        }
    ],
    "paths": [
        {
            "nodes": [
                "ref-chr5:70243962-70244111",
                "ref-chr5:70244112-70245000",
                "ref-chr5:70245001-70245150"
            ],
            "path_id": "REF|1",
            "sequence": "REF"
        }
    ],
    "sequencenames": [
        "ALT",
        "REF"
    ],
    "target_regions": [
        "chr5:70243962-70245150"
    ]
}
